{
  "artifact_type": "alpha_artifact",
  "artifact_version": "1.0",
  "alpha_id": "lean_us_index_momentum",
  "version": "1.0.0",
  "name": "US index-fund momentum (LEAN)",
  "description": "Six-month momentum ranking across four US index funds, reweighted monthly, long only.",
  "localized_name": {
    "ar": "زخم صناديق المؤشرات الأمريكية",
    "en": "US Index-Fund Momentum"
  },
  "localized_description": {
    "ar": "دراسة بحثية تصنّف أربعة صناديق مؤشرات أمريكية وفق زخم ستة أشهر وتعيد ترجيحها شهرياً، شراء فقط، لدعم القرار فقط.",
    "en": "Research study ranking four US index funds by six-month momentum and reweighting monthly, long only, for decision support."
  },
  "author": "research@orion.sa",
  "classification": {
    "object_type": "ALPHA",
    "venue": "US",
    "asset_class": "ETF",
    "family": "MOMENTUM",
    "horizon": "MONTHS",
    "direction": "LONG_ONLY",
    "rebalance": "MONTHLY"
  },
  "provenance": {
    "source_engine": "LEAN_QUANTCONNECT",
    "run_type": "ENGINE_RUN",
    "run_at": "2026-09-24T19:11:19Z",
    "run_by": "lean-launcher",
    "data_snapshot": "lean-local-data:sha256:f7ebf104a31d8ec39326595e48a48e054b91e56e2a4bc63a0f44ffd502eff062",
    "report_source": null
  },
  "metric_basis": {
    "currency": "USD",
    "benchmark": "lean_quantconnect.spy_pr",
    "risk_free_rate": 1.760534,
    "risk_free_rate_unit": "PERCENT",
    "return_metric_unit": "PERCENT",
    "turnover_unit": "MULTIPLE",
    "probability_unit": "PERCENT",
    "return_series_unit": "FRACTION"
  },
  "metrics": {
    "sharpe": 0.6415,
    "annual_return": 17.1200,
    "max_drawdown": -30.700,
    "turnover": 3.2760,
    "psr": 22.9500,
    "benchmark_return": 91.81923603353848000449141501,
    "sortino": 0.6034,
    "beta": 1.0035,
    "annual_volatility": 17.8400,
    "information_ratio": 0.0942,
    "value_at_risk_95": -0.018,
    "value_at_risk_99": -0.025
  },
  "backtest": {
    "start": "2017-01-03",
    "end": "2021-03-31",
    "min_years": 3
  },
  "return_series": {
    "kind": "BACKTEST",
    "frequency": "DAILY",
    "unit": "FRACTION",
    "observations": [
      {
        "date": "2017-01-03",
        "value": 0.0068881450
      },
      {
        "date": "2017-01-04",
        "value": 0.0110000075
      },
      {
        "date": "2017-01-05",
        "value": -0.0029582429
      },
      {
        "date": "2017-01-06",
        "value": 0.0025715851
      },
      {
        "date": "2017-01-09",
        "value": -0.0015765003
      },
      {
        "date": "2017-01-10",
        "value": 0.0058047327
      },
      {
        "date": "2017-01-11",
        "value": 0.0022246207
      },
      {
        "date": "2017-01-12",
        "value": -0.0045649025
      },
      {
        "date": "2017-01-13",
        "value": 0.0052807444
      },
      {
        "date": "2017-01-17",
        "value": -0.0081819040
      },
      {
        "date": "2017-01-18",
        "value": 0.0026319953
      },
      {
        "date": "2017-01-19",
        "value": -0.0042322048
      },
      {
        "date": "2017-01-20",
        "value": 0.0036285563
      },
      {
        "date": "2017-01-23",
        "value": -0.0016171044
      },
      {
        "date": "2017-01-24",
        "value": 0.0108739496
      },
      {
        "date": "2017-01-25",
        "value": 0.0097091186
      },
      {
        "date": "2017-01-26",
        "value": -0.0014298158
      },
      {
        "date": "2017-01-27",
        "value": -0.0007007313
      },
      {
        "date": "2017-01-30",
        "value": -0.0107504229
      },
      {
        "date": "2017-01-31",
        "value": 0.0023613752
      },
      {
        "date": "2017-02-01",
        "value": 0.0031249024
      },
      {
        "date": "2017-02-02",
        "value": -0.0016882232
      },
      {
        "date": "2017-02-03",
        "value": 0.0090220493
      },
      {
        "date": "2017-02-06",
        "value": -0.0031646137
      },
      {
        "date": "2017-02-07",
        "value": -0.0003698716
      },
      {
        "date": "2017-02-08",
        "value": -0.0000447355
      },
      {
        "date": "2017-02-09",
        "value": 0.0087847802
      },
      {
        "date": "2017-02-10",
        "value": 0.0054289543
      },
      {
        "date": "2017-02-13",
        "value": 0.0041193964
      },
      {
        "date": "2017-02-14",
        "value": 0.0033310291
      },
      {
        "date": "2017-02-15",
        "value": 0.0059286936
      },
      {
        "date": "2017-02-16",
        "value": -0.0015439688
      },
      {
        "date": "2017-02-17",
        "value": 0.0018461963
      },
      {
        "date": "2017-02-21",
        "value": 0.0063544058
      },
      {
        "date": "2017-02-22",
        "value": -0.0020022497
      },
      {
        "date": "2017-02-23",
        "value": -0.0048280031
      },
      {
        "date": "2017-02-24",
        "value": 0.0006099330
      },
      {
        "date": "2017-02-27",
        "value": 0.0054255697
      },
      {
        "date": "2017-02-28",
        "value": -0.0091872940
      },
      {
        "date": "2017-03-01",
        "value": 0.0145208529
      },
      {
        "date": "2017-03-02",
        "value": -0.0082225551
      },
      {
        "date": "2017-03-03",
        "value": 0.0005551654
      },
      {
        "date": "2017-03-06",
        "value": -0.0045108348
      },
      {
        "date": "2017-03-07",
        "value": -0.0040835021
      },
      {
        "date": "2017-03-08",
        "value": -0.0023726315
      },
      {
        "date": "2017-03-09",
        "value": -0.0015731989
      },
      {
        "date": "2017-03-10",
        "value": 0.0042988976
      },
      {
        "date": "2017-03-13",
        "value": 0.0020014899
      },
      {
        "date": "2017-03-14",
        "value": -0.0035714524
      },
      {
        "date": "2017-03-15",
        "value": 0.0107194534
      },
      {
        "date": "2017-03-16",
        "value": 0.0003027376
      },
      {
        "date": "2017-03-17",
        "value": 0.0017956309
      },
      {
        "date": "2017-03-20",
        "value": -0.0017964721
      },
      {
        "date": "2017-03-21",
        "value": -0.0214477744
      },
      {
        "date": "2017-03-22",
        "value": 0.0035360313
      },
      {
        "date": "2017-03-23",
        "value": 0.0015651330
      },
      {
        "date": "2017-03-24",
        "value": 0.0014111933
      },
      {
        "date": "2017-03-27",
        "value": 0.0017242447
      },
      {
        "date": "2017-03-28",
        "value": 0.0069127181
      },
      {
        "date": "2017-03-29",
        "value": 0.0039305845
      },
      {
        "date": "2017-03-30",
        "value": 0.0045507414
      },
      {
        "date": "2017-03-31",
        "value": 0.0004466687
      },
      {
        "date": "2017-04-03",
        "value": -0.0055686480
      },
      {
        "date": "2017-04-04",
        "value": 0.0002126144
      },
      {
        "date": "2017-04-05",
        "value": -0.0076485203
      },
      {
        "date": "2017-04-06",
        "value": 0.0048512354
      },
      {
        "date": "2017-04-07",
        "value": -0.0004846888
      },
      {
        "date": "2017-04-10",
        "value": 0.0012853198
      },
      {
        "date": "2017-04-11",
        "value": 0.0017766191
      },
      {
        "date": "2017-04-12",
        "value": -0.0087775728
      },
      {
        "date": "2017-04-13",
        "value": -0.0068339353
      },
      {
        "date": "2017-04-17",
        "value": 0.0099590999
      },
      {
        "date": "2017-04-18",
        "value": -0.0006517495
      },
      {
        "date": "2017-04-19",
        "value": 0.0025221445
      },
      {
        "date": "2017-04-20",
        "value": 0.0105032403
      },
      {
        "date": "2017-04-21",
        "value": -0.0012339641
      },
      {
        "date": "2017-04-24",
        "value": 0.0122174843
      },
      {
        "date": "2017-04-25",
        "value": 0.0084382591
      },
      {
        "date": "2017-04-26",
        "value": 0.0018531118
      },
      {
        "date": "2017-04-27",
        "value": 0.0028412541
      },
      {
        "date": "2017-04-28",
        "value": -0.0057918311
      },
      {
        "date": "2017-05-01",
        "value": 0.0072875297
      },
      {
        "date": "2017-05-02",
        "value": -0.0016904609
      },
      {
        "date": "2017-05-03",
        "value": -0.0046714357
      },
      {
        "date": "2017-05-04",
        "value": -0.0004975822
      },
      {
        "date": "2017-05-05",
        "value": 0.0050231678
      },
      {
        "date": "2017-05-08",
        "value": -0.0009746209
      },
      {
        "date": "2017-05-09",
        "value": 0.0015381214
      },
      {
        "date": "2017-05-10",
        "value": 0.0033573662
      },
      {
        "date": "2017-05-11",
        "value": -0.0038459389
      },
      {
        "date": "2017-05-12",
        "value": -0.0014730864
      },
      {
        "date": "2017-05-15",
        "value": 0.0054289343
      },
      {
        "date": "2017-05-16",
        "value": 0.0022845325
      },
      {
        "date": "2017-05-17",
        "value": -0.0261227364
      },
      {
        "date": "2017-05-18",
        "value": 0.0062120099
      },
      {
        "date": "2017-05-19",
        "value": 0.0044962796
      },
      {
        "date": "2017-05-22",
        "value": 0.0075839590
      },
      {
        "date": "2017-05-23",
        "value": 0.0021198153
      },
      {
        "date": "2017-05-24",
        "value": 0.0026547564
      },
      {
        "date": "2017-05-25",
        "value": 0.0046480210
      },
      {
        "date": "2017-05-26",
        "value": 0.0007634036
      },
      {
        "date": "2017-05-30",
        "value": -0.0033865892